adjective,gender,discipline,file_names,total_count,affect_count,judgement_count,appreciation_count,ambiguous_count,p_affect,p_judgement,p_appreciation,assigned_class,assigned_confidence,example_affect,example_judgement,example_appreciation,example_ambiguous
small,m,med,Med10_en.conllu || Med11_en.conllu || Med12_en.conllu || Med13_en.conllu || Med17_en.conllu || Med6_en.conllu || Med8_en.conllu,12,0,0,1,11,0.0,0.0,1.0,appreciation,1.0,,,"This vaccine is so small it can be grown in a common bacteria , E. coli .","And despite their extremely small sizes , they have these incredible properties . || One small paper sensor that costs three cents and takes five minutes to run . || If I ca n't come clean and talk about my mistakes , if I ca n't find the still - small voice that tells me what really happened , how can I share it with my colleagues ? || Now , some of us are old enough to have a small , circular scar on our arms from an inoculation we received as children . || Notice these other , smaller protuberances ."
early,m,med,Med10_en.conllu || Med12_en.conllu || Med7_en.conllu || Med8_en.conllu || Med9_en.conllu,12,0,0,1,11,0.0,0.0,1.0,appreciation,1.0,,,"Now you can imagine looking at Jonas at only 14 , that male puberty is early in this family , because he looks more like a 16 - year - old . But it makes the point all the more , of why you have to be conscious of where the patient is .","Essentially , first , the protein would have to be found in all pancreatic cancers , at high levels in the bloodstream , in the earliest stages , but also only in cancer . || But also , the key is that it 's found in the earliest stages of the disease , when someone has close to 100 percent chance of survival . || One of the best parts of the sensor , though , is that it has close to 100 percent accuracy , and can detect the cancer in the earliest stages , when someone has close to 100 percent chance of survival . || Newer concepts and early testing now show even greater promise in the best of our animal models . || Well , we first figured out how to make flu vaccines , how to produce them , in the early 1940s ."
obese,m,med,Med13_en.conllu || Med14_en.conllu,12,0,0,6,6,0.0,0.0,1.0,appreciation,1.0,,,"This here shows , on the Y - axis , the increase in the probability that a person is obese given that a social contact of theirs is obese and , on the X - axis , the degrees of separation between the two people . || It says that , if your friends are obese , your risk of obesity is 45 percent higher . || And the next bar over , the [ red ] line , says if your friend 's friends are obese , your risk of obesity is 25 percent higher . || And then the next line over says if your friend 's friend 's friend , someone you probably do n't even know , is obese , your risk of obesity is 10 percent higher . || And we found that if your friend becomes obese , it increases your risk of obesity by about 57 percent in the same given time period .","The top curve shows the body weight of a genetically obese mouse that eats nonstop until it turns fat , like this furry tennis ball . || If you take the obese mouse and give it an angiogenesis inhibitor , it loses weight . || The truly interesting thing about this is that we ca n't take these obese mice and make them lose more weight than what the normal mouse 's weight is supposed to be . || In addition , if your body size , if your BMI , your body mass index , is above 30 -- if you 're clinically obese -- we also colored the dots yellow . || So , if you look at this image , right away you might be able to see that there are clusters of obese and non-obese people in the image ."
common,m,med,Med11_en.conllu || Med12_en.conllu || Med13_en.conllu || Med14_en.conllu || Med17_en.conllu || Med7_en.conllu,11,0,0,1,10,0.0,0.0,1.0,appreciation,1.0,,,This is not that common .,"I memorized in my anatomy class the origins and exertions of every muscle , every branch of every artery that came off the aorta , differential diagnoses obscure and common . || Even worse , the most common influenza -- influenza A -- also infects animals that live in close proximity to humans , and they can recombine in those particular animals . || This vaccine is so small it can be grown in a common bacteria , E. coli . || In total , there are more than 70 major diseases affecting more than a billion people worldwide , that all look on the surface to be different from one another , but all actually share abnormal angiogenesis as their common denominator . || They 're all common ones : Chinese jasmine , Japanese sencha , Earl Grey and a special blend that we prepared , and you can see clearly that the teas vary in their potency , from less potent to more potent ."
happy,m,med,Med13_en.conllu || Med14_en.conllu || Med8_en.conllu,10,2,3,0,5,0.4,0.6,0.0,judgement,0.6,"And so it is not just what 's happening to these people -- whether they 're losing weight or gaining weight , or becoming rich or becoming poor , or becoming happy or not becoming happy -- that affects us ; it 's also the actual architecture of the ties around us .","Again , a social network , but now we color the people yellow if they 're happy and blue if they 're sad and green in between . || Well , they were happy as could be , because he had n't said a rational word in the weeks of observation . || It 's been very happy .",,"And here he is six years later , Guinness , with his very happy owner . || And if you look at this image , you can right away see clusters of happy and unhappy people , again , spreading to three degrees of separation . || So to invoke another metaphor , if you imagine social networks as a kind of vast fabric of humanity -- I 'm connected to you and you to her , on out endlessly into the distance -- this fabric is actually like an old - fashioned American quilt , and it has patches on it : happy and unhappy patches . || And whether you become happy or not depends in part on whether you occupy a happy patch ."
large,m,med,Med12_en.conllu || Med13_en.conllu || Med14_en.conllu || Med17_en.conllu || Med8_en.conllu,10,0,1,0,9,0.0,1.0,0.0,judgement,1.0,,"Then they ca n't get any larger because they do n't have a blood supply , so they do n't have enough oxygen or nutrients .",,"A few years ago , Professor Vaclav Smil tried to calculate the probability of sudden disasters large enough to change history . || Large companies moved away from it because they thought the science was so difficult and vaccines were seen as poor business . || And our search for this has taken us to the market , the farm and to the spice cabinet , because what we 've discovered is that Mother Nature has laced a large number of foods and beverages and herbs with naturally - occurring inhibitors of angiogenesis . || Could emotion spread , in a more sustained way than riots , across time and involve large numbers of people , not just this pair of individuals smiling at each other in the subway car ? || Now , a superorganism is a collection of individuals which show or evince behaviors or phenomena that are not reducible to the study of individuals and that must be understood by reference to , and by studying , the collective . Like , for example , a hive of bees that 's finding a new nesting site , or a flock of birds that 's evading a predator , or a flock of birds that 's able to pool its wisdom and navigate and find a tiny speck of an island in the middle of the Pacific , or a pack of wolves that 's able to bring down larger prey ."
more,m,phi,Phi11_en.conllu || Phi12_en.conllu || Phi13_en.conllu || Phi14_en.conllu || Phi1_en.conllu || Phi2_en.conllu || Phi3_en.conllu || Phi4_en.conllu || Phi5_en.conllu || Phi7_en.conllu,42,0,1,0,41,0.0,1.0,0.0,judgement,1.0,,It 's ubiquitous and it wants to be more .,,"In Montana today , more than half of the income of Montana is not earned within Montana , but is derived from out of state : transfer payments from social security , investments and so on -- which makes Montana vulnerable to the rest of the United States . || There 's no more food and the bacteria have collapsed . || For example , among the Greenland Norse -- a competitive rank society -- what the chiefs really wanted is more followers and more sheep and more resources to outcompete the neighboring chiefs . || Well , all of us know the dozen sorts of ticking time bombs going on in the modern world , time bombs that have fuses of a few decades to -- all of them , not more than 50 years , and any one of which can do us in ; the time bombs of water , of soil , of climate change , invasive species , the photosynthetic ceiling , population problems , toxics , etc. , etc. -- listing about 12 of them . || More and more of the inert matter of the globe is being touched and animated by life ."
wrong,m,phi,Phi13_en.conllu || Phi14_en.conllu || Phi1_en.conllu || Phi2_en.conllu || Phi3_en.conllu || Phi4_en.conllu || Phi5_en.conllu || Phi7_en.conllu || Phi9_en.conllu,41,2,3,7,29,0.1667,0.25,0.5833,appreciation,0.5833,Do n't get me wrong . || And if we have misconstrued the relationship between biological complexity and the possibilities of experience well then we could be wrong about the inner lives of insects .,"So , for instance , if it 's really wrong to lie , it must always be wrong to lie , and if you can find an exception , well then there 's no such thing as moral truth . || And who are we to say , even , that they 're wrong to beat them with lengths of steel cable , or throw battery acid in their faces if they decline the privilege of being smothered in this way ? || Most Western intellectuals look at this situation and say , "" Well , there 's nothing for the Dalai Lama to be really right about -- really right about -- or for Ted Bundy to be really wrong about that admits of a real argument that potentially falls within the purview of science .","When things go wrong , as of course they do , we reach for two tools to try to fix them . || Now , it is the position , generally speaking , of our intellectual community that while we may not like this , we might think of this as "" wrong "" in Boston or Palo Alto , who are we to say that the proud denizens of an ancient culture are wrong to force their wives and daughters to live in cloth bags ? || Something was wrong . || There are things that are intrinsically wrong -- like lying is wrong , like torturing innocent children is wrong . || Now , we know that that 's wrong .","Now , it 's generally understood that questions of morality -- questions of good and evil and right and wrong -- are questions about which science officially has no opinion . || This is something that we could be right or wrong about . || We know that it 's possible to live in a failed state , where everything that can go wrong does go wrong -- where mothers can not feed their children , where strangers can not find the basis for peaceful collaboration , where people are murdered indiscriminately . || And we know -- we know -- that there are right and wrong answers to how to move in this space . || And just admitting this -- just admitting that there are right and wrong answers to the question of how humans flourish -- will change the way we talk about morality , and will change our expectations of human cooperation in the future ."
first,m,phi,Phi10_en.conllu || Phi11_en.conllu || Phi12_en.conllu || Phi13_en.conllu || Phi14_en.conllu || Phi15_en.conllu || Phi1_en.conllu || Phi2_en.conllu || Phi3_en.conllu || Phi4_en.conllu || Phi5_en.conllu || Phi7_en.conllu,40,1,0,0,39,1.0,0.0,0.0,affect,1.0,"But the thing that struck me is , one guy said in exasperation , a very famous neurobiologist , he said , "" Look , in my discipline it 's okay to be interested in consciousness , but get tenure first . Get tenure first . """,,,"Or by the first person to rush into the hall to get them . || How many here favor the first policy : the state should recognize traditional marriage only ? || Well , in my five - point framework , the first item on the framework is to look for human impacts on the environment : people inadvertently destroying the resource base on which they depend . || And Montana , at first sight , seems like the most pristine environment in the United States . || What it means to put it mathematically is that , if you 're concerned about a society today , you should be looking not at the value of the mathematical function -- the wealth itself -- but you should be looking at the first derivative and the second derivatives of the function ."
same,m,phi,Phi10_en.conllu || Phi11_en.conllu || Phi12_en.conllu || Phi13_en.conllu || Phi15_en.conllu || Phi2_en.conllu || Phi4_en.conllu || Phi5_en.conllu || Phi7_en.conllu || Phi9_en.conllu,39,0,0,3,36,0.0,0.0,1.0,appreciation,1.0,,,"So the major trends in technology evolution actually are the same as in biological evolution . || When incentives do n't work , when CEOs ignore the long - term health of their companies in pursuit of short - term gains that will lead to massive bonuses , the response is always the same . || And just to make a long story short : first of all , the concept of fairness is not the same as the concept of sameness .","Look at all the arguments we have these days over health care , over bonuses and bailouts on Wall Street , over the gap between rich and poor , over affirmative action and same - sex marriage . || Let 's take a final example that 's prominent in contemporary political debate : same - sex marriage . || There are those who favor state recognition only of traditional marriage between one man and one woman , and there are those who favor state recognition of same - sex marriage . || And how many favor the second , same - sex marriage ? || The opponents of same - sex marriage say that the purpose of marriage , fundamentally , is procreation , and that 's what 's worthy of honoring and recognizing and encouraging ."
great,m,phi,Phi10_en.conllu || Phi11_en.conllu || Phi12_en.conllu || Phi14_en.conllu || Phi15_en.conllu || Phi1_en.conllu || Phi2_en.conllu || Phi3_en.conllu || Phi4_en.conllu || Phi5_en.conllu || Phi7_en.conllu || Phi9_en.conllu,38,0,1,3,34,0.0,0.25,0.75,appreciation,0.75,,It was great for their genetic fitness .,"For example , the classic lowland Maya of the Yucatan began to collapse in the early 800s -- literally a few decades after the Maya were building their biggest monuments , and Maya population was greatest . || Craig Venter 's tremendous and brilliant attempt to DNA sequence things in the ocean is great . || But that is great .","The greatest benefit to all . || He says , "" I 'm a great golfer . I want to compete . But I need a golf cart to get from one hole to the next . "" || So if golfing is the kind of game that can be played while riding around in a golf cart , it would be hard to confer on the golfing greats the status that we confer , the honor and recognition that goes to truly great athletes . || I think all of us have been interested , at one time or another , in the romantic mysteries of all those societies that collapsed , such as the classic Maya in the Yucatan , the Easter Islanders , the Anasazi , Fertile Crescent society , Angor Wat , Great Zimbabwe and so on . And within the last decade or two , archaeologists have shown us that there were environmental problems underlying many of these past collapses . || And we know that the Inuit killed the Norse and , probably of greater importance , may have blocked access to the outer fjords , on which the Norse depended for seals at a critical time of the year ."
important,m,phi,Phi10_en.conllu || Phi11_en.conllu || Phi12_en.conllu || Phi13_en.conllu || Phi14_en.conllu || Phi15_en.conllu || Phi1_en.conllu || Phi2_en.conllu || Phi3_en.conllu || Phi5_en.conllu || Phi7_en.conllu,33,0,2,3,28,0.0,0.4,0.6,appreciation,0.6,,And I think it 's really important . || This actually is one of DARPA 's very important -- DARPA is the Defense Research Agency -- one of their projects .,"In fact , this idea of resurrecting the whole idea is so important that I began to think about what happens with old technology . || That 's really important . || This is important .","The fatigue factor is an important part of golf . || People often ask me , Jared , what 's the most important thing that we need to do about the world 's environmental problems ? || And my answer is , the most important thing we need to do is to forget about there being any single thing that is the most important thing we need to do . || It 's short , bone handle , 50 bucks . And in fact , what 's important is that this information actually never died out . || And finally , perhaps most important , a wise person is made , not born ."
different,m,phi,Phi10_en.conllu || Phi11_en.conllu || Phi12_en.conllu || Phi13_en.conllu || Phi14_en.conllu || Phi15_en.conllu || Phi1_en.conllu || Phi2_en.conllu || Phi3_en.conllu || Phi4_en.conllu || Phi5_en.conllu || Phi9_en.conllu,31,0,0,2,29,0.0,0.0,1.0,appreciation,1.0,,,"In a way , just like Tolstoy 's statement about every unhappy marriage being different , every collapsed or endangered society is different -- they all have different details . || We just see a little tiny part of reality that 's described by the laws of quantum field theory , but there are many , many other worlds , parts of reality that are described by vastly different theories that are different from ours in ways we ca n't imagine , that are inconceivably exotic .","Aristotle had a different reason for saying the best flutes should go to the best flute players . || In a way , just like Tolstoy 's statement about every unhappy marriage being different , every collapsed or endangered society is different -- they all have different details . || It turns out that there were about nine different environmental factors -- some , rather subtle ones -- that were working against the Easter Islanders , and they involve fallout of volcanic tephra , latitude , rainfall . || Six different broad approaches : the plants , the animals , the fungi , the protests -- the little things -- the bacteria and the Archaea bacteria . || But we see that each one of these is actually hacking , and has a different way of finding out how to do life ."
bad,m,phi,Phi10_en.conllu || Phi11_en.conllu || Phi12_en.conllu || Phi13_en.conllu || Phi14_en.conllu || Phi15_en.conllu || Phi1_en.conllu || Phi3_en.conllu || Phi5_en.conllu || Phi7_en.conllu,29,0,2,4,23,0.0,0.3333,0.6667,appreciation,0.6667,,It gets worse than that -- or perhaps better than that . || Has it gotten worse ?,"Where what 's good in the short run for the elite is bad for the society as a whole , there 's a real risk of the elite doing things that would bring the society down in the long run . || See -- most Americans believe that poverty has gotten worse since we were children , since they saw that vision . || If you ask Americans , "" Has poverty gotten worse or better around the world ? "" , 70 percent will say that hunger has gotten worse since the early 1970s .","The worst flute players . || He was a very good golfer , but he had a disability . He had a bad leg , a circulatory problem , that made it very painful for him to walk the course . || But a cold climate is n't necessarily fatal , because the Inuit -- the Eskimos inhabiting Greenland at the same time -- did better , rather than worse , with cold climates . || In the case of Norse Greenland , the hostiles were the Inuit -- the Eskimos sharing Greenland -- with whom the Norse got off to bad relationships . || Yes -- the climate in Montana is getting warmer and drier , but Montana agriculture depends especially on irrigation from the snow pack , and as the snow is melting -- for example , as the glaciers in Glacier National Park are disappearing -- that 's bad news for Montana irrigation agriculture ."
possible,m,phi,Phi10_en.conllu || Phi14_en.conllu || Phi15_en.conllu || Phi3_en.conllu || Phi7_en.conllu || Phi9_en.conllu,28,0,1,2,25,0.0,0.3333,0.6667,appreciation,0.6667,,That 's how it 's possible for consciousness to function causally .,"I 'm going to tell you how that 's possible . || I gave you a scientific demonstration by raising my hand , but how is that possible ?","And Justice Stevens , writing for the majority , said he had read all about the history of golf , and the essential point of the game is to get very small ball from one place into a hole in as few strokes as possible , and that walking was not essential , but incidental . || He said it 's not possible to determine the essential nature of a game like golf . || Let me put the point as delicately as possible : || And there 's no notion , no version of human morality and human values that I 've ever come across that is not at some point reducible to a concern about conscious experience and its possible changes . || We know that it 's possible to live in a failed state , where everything that can go wrong does go wrong -- where mothers can not feed their children , where strangers can not find the basis for peaceful collaboration , where people are murdered indiscriminately ."
conscious,m,phi,Phi14_en.conllu || Phi7_en.conllu,22,1,0,0,21,1.0,0.0,0.0,affect,1.0,"Well , it is the most important aspect of our lives for a very simple , logical reason , namely , it 's a necessary condition on anything being important in our lives that we 're conscious .",,,"They are facts about the well - being of conscious creatures . || And there 's no notion , no version of human morality and human values that I 've ever come across that is not at some point reducible to a concern about conscious experience and its possible changes . || So , what I 'm arguing is that value 's reduced to facts -- to facts about the conscious experience of conscious beings . || And I think of this as kind of a moral landscape , with peaks and valleys that correspond to differences in the well - being of conscious creatures , both personal and collective . || All of our conscious states , without exception , are caused by lower - level neurobiological processes in the brain , and they are realized in the brain as higher - level or system features ."
hard,m,phi,Phi10_en.conllu || Phi11_en.conllu || Phi12_en.conllu || Phi13_en.conllu || Phi14_en.conllu || Phi15_en.conllu || Phi2_en.conllu || Phi3_en.conllu || Phi5_en.conllu || Phi7_en.conllu,20,0,1,3,16,0.0,0.25,0.75,appreciation,0.75,,"Even when we try to get rid of a technology , it 's actually very hard .",And the other generalization that I want to mention is that it 's particularly hard for a society to make quote - unquote good decisions when there is a conflict involving strongly held values that are good in many circumstances but are poor in other circumstances . || Ethics is hard . || People always say consciousness is very hard to define .,"But here 's a harder question . || So if golfing is the kind of game that can be played while riding around in a golf cart , it would be hard to confer on the golfing greats the status that we confer , the honor and recognition that goes to truly great athletes . || That illustrates that with golf , as with flutes , it 's hard to decide the question of what justice requires , without grappling with the question , "" What is the essential nature of the activity in question , and what qualities , what excellences connected with that activity , are worthy of honor and recognition ? "" || Very hard to argue about justice without first arguing about the purpose of social institutions and about what qualities are worthy of honor and recognition . || All they had was Mike 's Hard Lemonade , which was five percent alcohol ."
true,m,phi,Phi12_en.conllu || Phi14_en.conllu || Phi1_en.conllu || Phi2_en.conllu || Phi4_en.conllu || Phi5_en.conllu || Phi7_en.conllu || Phi9_en.conllu,14,0,1,6,7,0.0,0.1429,0.8571,appreciation,0.8571,,"It 's a pious hope , I wish it were true , but I think the other day he admitted to me it 's really an ugly universe .","Every single thing that we can think of -- and if you heard Olivia 's talk about the sexual habits , you 'll realize that there is n't anything we can say that 's true for all life , because every single one of them is hacking something about it . || And to say that such changes can persist after death is itself a factual claim , which , of course , may or may not be true . || Is this proposition true ? || My problem is , some of the bits in it I do n't think are true . || Now -- the story might seem to good to be true , but when you administer batteries of psychological tests , you get the same results -- namely , identical twins separated at birth show quite astonishing similarities .","So I 'm still perplexed about what the true meaning of technology is as it relates to humanity , as it relates to nature , as it relates to the spiritual . || We have a moral obligation to invent technology so that every person on the globe has the potential to realize their true difference . || Because I want to say that much the same thing is true of religions . || True story . || There might be some way of treating that as true ."
