adjective,gender,discipline,file_names,total_count,affect_count,judgement_count,appreciation_count,ambiguous_count,p_affect,p_judgement,p_appreciation,assigned_class,assigned_confidence,example_affect,example_judgement,example_appreciation,example_ambiguous
different,f,art,Art16_en.conllu || Art3_en.conllu || Art4_en.conllu || Art5_en.conllu,18,2,0,0,16,1.0,0.0,0.0,affect,1.0,So how do we change the stigma around looking different or not fitting into this narrow definition of beauty ? || Let go of trying to change it or even wanting it to be different .,,,"So , I get to put in all of the things that I love . Hopefully , a dialog between adults and children will happen on many different levels , and hopefully different kinds of humor will evolve . || I pored over all different types of fashion magazines at my local Barnes and Noble . || I believe it 's by celebrating beauty in all different forms , bold and unapologetically . || Different - size bodies are n't taken into account during the design process . || It 's about seeing people of all different gender expressions , different ability levels , different ages , different races and ethnicities , celebrated for their own unique beauty ."
good,f,art,Art10_en.conllu || Art16_en.conllu || Art1_en.conllu || Art3_en.conllu || Art4_en.conllu || Art5_en.conllu,17,0,0,1,16,0.0,0.0,1.0,appreciation,1.0,,,"So , I hopefully am writing , you know , books that are good for children and for adults .","Do n't you love a good nap ? || And almost , I would almost call it being simple - minded , but in the best sense of the word . || And I finally daydreamed my way into NYU , at a very good time , in 1967 , where I met a man who was trying to blow up the math building of NYU . || And that was a good thing to help , you know , the cause . || And as a matter of fact , it 's better not to know anything , because if you know too much , you 're stymied ."
able,f,art,Art16_en.conllu || Art3_en.conllu || Art4_en.conllu || Art5_en.conllu,13,8,2,0,3,0.8,0.2,0.0,affect,0.8,"So , I was able to completely daydream my way through my life . || But I am able to make the transition from working for children and -- from working for adults to children , and back and forth , because , you know , I can say that I 'm immature , and in a way , that 's true . || And so , I was able to put that into this story , which is an alphabet , and hopefully go on to something else . || And with him , I was able to do a project that was really fantastic . || And Rick and I were on our way to a party in the Bronx , and somebody said Bronxistan , and somebody said Ferreristan , and we came up with this New Yorker cover , which we were able to -- we did n't know what we were doin We were n't trying to be funny , we were n't trying to be -- well , we were trying to be funny actually , that 's not true .","But it actually was n't until recently that we were able to expand our size range in a major way . || Through creativity and solidarity , Amber Hasan , Shea Cobb , Tuklor Senegal , The Sister Tour , myself , the people of Flint , Dexter Moon , Moses West and his atmospheric water generator have been able to provide 120,000 gallons of free , clean water .",,"And some of the watches there , attempting to be beautiful and humorous -- maybe not attempting , hopefully succeeding . That to be able to talk about content , to break apart what you normally expect , to use humor and surprise , elegance and humanity in your work was really important to us . || For so long , the fashion industry has worked hard to set an ideal of beauty that celebrates thin , young , white , cisgender , able - bodied models as the ideal . || And this is an important piece of the puzzle that many young designers may not think about when they 're first starting their careers , but hiring a plus - size or a transgender photographer , or a woman of color as your casting director , or a black makeup artist -- hey , Fatima Thomas -- who intimately understands how important it is to be able to work with all skin tones : it 's essential to creating a holistically inclusive output , like this one ."
beautiful,f,art,Art16_en.conllu || Art3_en.conllu || Art5_en.conllu,12,1,0,0,11,1.0,0.0,0.0,affect,1.0,"We choose who is cast in our runway shows and campaigns , and ultimately , who is celebrated and considered beautiful , and who is not .",,,"And some of the watches there , attempting to be beautiful and humorous -- maybe not attempting , hopefully succeeding . That to be able to talk about content , to break apart what you normally expect , to use humor and surprise , elegance and humanity in your work was really important to us . || But I have been taking beautiful notes of drawings and I have a gorgeous onion from Murray Gell - Mann 's talk . || And I have a beautiful page of doodles from Jonathan Woodham 's talk . || But anyway , so we were in Venice , and this is our room . And I had this dream that I was wearing this fantastic green gown , and I was looking out the window , and it was really a beautiful thing . || So , "" My beautiful mother 's family fled Russia as well . Too many pogroms ."
much,f,art,Art10_en.conllu || Art16_en.conllu || Art3_en.conllu || Art4_en.conllu || Art5_en.conllu,11,1,0,0,10,1.0,0.0,0.0,affect,1.0,"I got my paints , and I was n't a landscape painter , but I was n't really much of any kind of painter at all , so I had no attachment , no expectation , which allowed me to be reckless and free .",,,"It gave me so much strength to give myself permission to just block it all out and sing . || And as a matter of fact , it 's better not to know anything , because if you know too much , you 're stymied . || I 'm going to read quickly -- and probably I 'm going to edit some , because I do n't have that much time left -- a few of the columns . || And basically , I was so , you know , it was so amusing , because I said , "" Well , how much space do I have ? "" || And I said , "" Yes , but how much space do I have ? """
wonderful,f,art,Art16_en.conllu || Art1_en.conllu,11,0,0,1,10,0.0,0.0,1.0,appreciation,1.0,,,"We hoped we 'd be funny , but we did n't know it would be a cover , and we did n't know that that image , at the moment that it happened , would be something that would be so wonderful for a lot of people .","So , whenever he sees a suitcase in the house , because everybody 's always , you know , leaving , they 're always cranking this wonderful dog 's tail , and he runs to the other room . || So , you know , and I have lots of wonderful - looking friends . || And David Remnick , who was really wonderful about it , had one problem . He did n't like Al Zheimers , because he thought it would insult people with Alzheimer 's . || And they said yes , and they left me completely alone , which was a gorgeous , wonderful thing . || White wrote such wonderful , whimsical -- and actually , Strunk -- and then you come to the rules and , you know , there are lots of grammar things . "" Do you mind me asking a question ? Do you mind my asking a question ? "" "" Would , could , should , or would , should , could . "" And "" would "" is Coco Chanel 's lover , "" should "" is Edith Sitwell , and "" could "" is an August Sander subject . And , "" He noticed a large stain in the center of the rug . """
important,f,art,Art16_en.conllu || Art3_en.conllu || Art5_en.conllu,9,0,0,1,8,0.0,0.0,1.0,appreciation,1.0,,,"As someone who spends most of my time alone in a studio working , I had no idea that this kind of connection could be so important , so healing .","And some of the watches there , attempting to be beautiful and humorous -- maybe not attempting , hopefully succeeding . That to be able to talk about content , to break apart what you normally expect , to use humor and surprise , elegance and humanity in your work was really important to us . || It was a very high , it was a very impersonal time in design and we wanted to say , the content is what 's important , not the package , not the wrapping . || Behind the scenes , from the photographer , to the casting director , to the interns , who is making the decisions behind the scenes is just as important . || And this is an important piece of the puzzle that many young designers may not think about when they 're first starting their careers , but hiring a plus - size or a transgender photographer , or a woman of color as your casting director , or a black makeup artist -- hey , Fatima Thomas -- who intimately understands how important it is to be able to work with all skin tones : it 's essential to creating a holistically inclusive output , like this one . || I 've always felt it was important to show a range of different bodies in our runway shows and campaigns ."
true,f,art,Art16_en.conllu || Art1_en.conllu,7,0,1,4,2,0.0,0.2,0.8,appreciation,0.8,,"So now , my friends , if that is true , and it is true , what is the point ? ""","But I am able to make the transition from working for children and -- from working for adults to children , and back and forth , because , you know , I can say that I 'm immature , and in a way , that 's true . || And Rick and I were on our way to a party in the Bronx , and somebody said Bronxistan , and somebody said Ferreristan , and we came up with this New Yorker cover , which we were able to -- we did n't know what we were doin We were n't trying to be funny , we were n't trying to be -- well , we were trying to be funny actually , that 's not true . || So now , my friends , if that is true , and it is true , what is the point ? "" || It means "" I have enough . "" And that is utterly true .","And it 's true that I never saw anyone who looked like me in television or in films , and sure , my family and friends and teachers all constantly warned me that people like me did n't make it in Hollywood . || And in an ironic twist of fate , when I finally did get a role that would make all my dreams come true , it was a role that required me to be exactly who I was ."
dead,f,art,Art16_en.conllu,6,0,5,0,1,0.0,1.0,0.0,judgement,1.0,,"I received a box in the mail and it was wrapped with newspaper and there was the picture of the man on the newspaper and he was dead . || And I say , "" I hope he 's not really dead , just enjoying a refreshing lie - down in the snow , but the caption says he is dead . "" || And actually , he was . I think he 's dead , though I do n't know , maybe he 's not dead .",,"So , shot dead , smacked over the head , you know , thrown away ."
awful,f,art,Art16_en.conllu || Art5_en.conllu,6,1,0,0,5,1.0,0.0,0.0,affect,1.0,"We called this time "" the beautiful awful . """,,,"But , then he came back , and things happened , and I decided I really hated my writing , that it was awful , awful , purple prose . || "" The Impossibility of February "" is that February 's a really wretched month in New York and the images for me conjure up these really awful things . Well , not so awful . || Let 's take the opportunity to find something beautiful in the unknown , in the unpredictable , and even in the awful ."
safe,f,art,Art10_en.conllu || Art4_en.conllu || Art5_en.conllu,5,0,0,1,4,0.0,0.0,1.0,appreciation,1.0,,,I had come to the conclusion that homelessness was safer for me than being at home .,"Our teens take refuge in the transformative elements of the arts , and they depend on the safe space ChopArt provides for them to do that . || In 2017 , Shea and Amber cofounded artist collective The Sister Tour , whose mission is to provide a safe space for Flint artists . || That safe , very , very carefully rendered safe place that I created in all my other paintings , it was a myth ."
wrong,f,art,Art10_en.conllu || Art16_en.conllu || Art1_en.conllu,5,1,2,0,2,0.3333,0.6667,0.0,judgement,0.6667,"And it says , "" Ich habe genug , "" which is a Bach cantata , which I once thought meant "" I 've had it , I ca n't take it anymore , give me a break , "" but I was wrong .","And he was n't wrong . || I mean , I fired him , but he was n't wrong .",,"I , like thousands of other homeless youth , disappeared into the shadows of the city while the whole world kept spinning as if nothing at all had gone terribly wrong . || And so I did , I worked my hardest to overcome all the things that people said were wrong with me ."
high,f,art,Art16_en.conllu || Art4_en.conllu,5,0,1,0,4,0.0,1.0,0.0,judgement,1.0,,"It was a very high , it was a very impersonal time in design and we wanted to say , the content is what 's important , not the package , not the wrapping .",,"So , what I did when I was painting was I started singing , because I really adore singing , and I think that music is the highest form of all art . || The residents in Flint have been forced to drink with , cook with and bathe with bottled water , while paying the highest water bills in the country for water that is infected with deadly legionella bacteria . || Our 14 - year collaboration , "" The Notion of Family , "" was created out of our struggle to survive environmental racism , healthcare inequity and chemical emissions that were being deregulated and released from the United States Steel Corporation , making Braddock the town with the highest asthma and infant mortality rates in the country . || This technology pulls air through a high - volume air filter ."
free,f,art,Art4_en.conllu || Art5_en.conllu,5,0,0,1,4,0.0,0.0,1.0,appreciation,1.0,,,"Residents are free to walk up to the machine anywhere between 9 am and 8 pm daily and take as much as they want , alleviating them from standing in long lines for bottled water .","Nestle , the largest water - bottling company in the world , pumps 400 gallons of water per minute out of aquifers in Lake Michigan , nearly free of charge . || Bring relief of free , clean water to the people in Flint . Teach them how to use the machine , teach them how to take care of it , and most importantly , take ownership of the machine . || Through creativity and solidarity , Amber Hasan , Shea Cobb , Tuklor Senegal , The Sister Tour , myself , the people of Flint , Dexter Moon , Moses West and his atmospheric water generator have been able to provide 120,000 gallons of free , clean water . || I got my paints , and I was n't a landscape painter , but I was n't really much of any kind of painter at all , so I had no attachment , no expectation , which allowed me to be reckless and free ."
unknown,f,art,Art16_en.conllu || Art5_en.conllu,5,0,0,1,4,0.0,0.0,1.0,appreciation,1.0,,,"But in her lexicon , "" sorry , the rest unknown , thank you "" is "" sorry , the rest unknown , go to hell , "" because she could n't care less .","But then she says Tel Aviv and Lenin , which is the town they came from , and , "" Sorry , the rest unknown , thank you . "" || But in her lexicon , "" sorry , the rest unknown , thank you "" is "" sorry , the rest unknown , go to hell , "" because she could n't care less . || It was as though our whole family dynamic and all our established roles vanished and we were just all together in this unknown , feeling the same thing and taking care of each other . || Let 's take the opportunity to find something beautiful in the unknown , in the unpredictable , and even in the awful ."
dark,f,art,Art10_en.conllu || Art16_en.conllu || Art3_en.conllu || Art4_en.conllu,4,0,0,1,3,0.0,0.0,1.0,appreciation,1.0,,,"No matter how dark a situation may be , a camera can extract the light and turn a negative into a positive .","So never stop fighting to stand in your light because even in your darkest times , we see you . || "" And I think it must have been a very , very dark day when the Bolsheviks arrived . || It was a dark time in my life ; my eating disorder consumed me ."
big,f,art,Art1_en.conllu || Art5_en.conllu,4,0,0,1,3,0.0,0.0,1.0,appreciation,1.0,,,"Our stories do n't have an audience , our experiences wo n't resonate in the mainstream , our voices are too big a financial risk .","Rule number one : do n't let your big brother see you do anything stupid . || My big plan was to be a waitress to support my painting . || We 're all going to have big losses in our lives , maybe a job or a career , relationships , love , our youth ."
fantastic,f,art,Art16_en.conllu,4,0,0,1,3,0.0,0.0,1.0,appreciation,1.0,,,"And with him , I was able to do a project that was really fantastic .","But anyway , so we were in Venice , and this is our room . And I had this dream that I was wearing this fantastic green gown , and I was looking out the window , and it was really a beautiful thing . || So , I commissioned a wonderful composer , Nico Muhly , who wrote nine songs using the text , and we performed this fantastic evening of -- he wrote music for both amateurs and professionals . || And there he is , with this horrible electrical box on his rump in this fantastic , decrepit palace ."
simple,f,art,Art16_en.conllu || Art5_en.conllu,4,1,0,0,3,1.0,0.0,0.0,affect,1.0,"So , in writing for children , it seems simple , and it is .",,,"And almost , I would almost call it being simple - minded , but in the best sense of the word . || I 'm trying to figure out two very simple things : how to live and how to die , period . || These simple daily activities became our sacred ritual , and we repeated them day after day as the cancer grew ."
brown,f,art,Art1_en.conllu,4,0,0,1,3,0.0,0.0,1.0,appreciation,1.0,,,"I stayed out of the sun so that my skin would n't get too brown , I straightened my curls into submission .","Someone they looked at and saw as too brown , too fat , too poor , too unsophisticated . || I constantly tried to lose weight , I bought fancier and more expensive clothes . All so that when people looked at me , they would n't see a too fat , too brown , too poor Latina . || Ana in "" Real Women Have Curves "" was a brown , poor , fat Latina ."
more,f,bus,Bus10_en.conllu || Bus14_en.conllu || Bus15_en.conllu || Bus1_en.conllu,40,2,0,0,38,1.0,0.0,0.0,affect,1.0,I 'm even more of a fan of globalization . || What worries me more is a different nightmare scenario .,,,"Only about 12 percent of the decisions did they make an hour or more of their time . || They had 250 different kinds of mustards and vinegars and over 500 different kinds of fruits and vegetables and more than two dozen different kinds of bottled water -- and this was during a time when we actually used to drink tap water . || More people stopped when there were 24 , about 60 percent , than when there were six , about 40 percent . || And what we looked at was whether the number of fund offerings available in a retirement savings plan , the 401( k ) plan , does that affect people 's likelihood to save more for tomorrow . || And what we found was that , the more funds offered , indeed , there was less participation rate ."
good,f,bus,Bus10_en.conllu || Bus13_en.conllu || Bus14_en.conllu || Bus15_en.conllu || Bus1_en.conllu || Bus9_en.conllu,24,0,2,1,21,0.0,0.6667,0.3333,judgement,0.6667,,"Now choosing not to buy a jar of jam is probably good for us -- at least it 's good for our waistlines -- but it turns out that this choice overload problem affects us even in very consequential decisions . || They 're more likely to choose things that make them less satisfied , even when they do objectively better .","We have to be willing , as teachers and parents and entrepreneurs and scientists , we have to be willing to have proactive conversations about race with honesty and understanding and courage , not because it 's the right thing to do , but because it 's the smart thing to do , because our businesses and our products and our science , our research , all of that will be better with greater diversity .","Now choosing not to buy a jar of jam is probably good for us -- at least it 's good for our waistlines -- but it turns out that this choice overload problem affects us even in very consequential decisions . || We choose not to choose , even when it goes against our best self - interests . || They 're more likely to delay choosing -- procrastinate even when it goes against their best self - interest . || Now in the financial savings world , I think one of the best examples that has recently come out on how to best manage the choice offerings has actually been something that David Laibson was heavily involved in designing , which was the program that they have at Harvard . || If I show you 600 magazines and I divide them up into 10 categories , versus I show you 400 magazines and divide them up into 20 categories , you believe that I have given you more choice and a better choosing experience if I gave you the 400 than if I gave you the 600 ."
same,f,bus,Bus10_en.conllu || Bus13_en.conllu || Bus14_en.conllu || Bus15_en.conllu || Bus1_en.conllu || Bus9_en.conllu,12,0,0,1,11,0.0,0.0,1.0,appreciation,1.0,,,"And Skipper says his answers were always the same : "" Yes . ""","It 's the same information . || It 's the same number of choices . || This does express the humanity of what 's going on , and the personal relationships , but that is also like saying that it 's the same thing as a yard sale or a bake sale or babysitting . || It 's like saying yard sales are the same thing as eBay , or craft fairs are the same thing as Etsy . || The third thing , and this is what worries me the most , is the extent to which those same largely positive forces which are driving the rise of the global plutocracy also happen to be hollowing out the middle class in Western industrialized economies ."
great,f,bus,Bus13_en.conllu || Bus14_en.conllu || Bus15_en.conllu || Bus9_en.conllu,10,0,0,1,9,0.0,0.0,1.0,appreciation,1.0,,,Is n't that great ?,"When I talked to their CEO , he had this great line . || And I can tell you two great stories . || Think of all the years reformers of various stripes have tried to get rid of corruption in Russia , for instance , or how hard it is to re-regulate the banks even after the most profound financial crisis since the Great Depression , or even how difficult it is to get the big multinational companies , including those whose motto might be "" do n't do evil , "" to pay taxes at a rate even approaching that paid by the middle class . || The result is something that economists Alan Krueger and Miles Corak call the Great Gatsby Curve . || But it 's important to remember that before we learned how to share the fruits of the Industrial Revolution with the broad swathes of society , we had to go through two depressions , the Great Depression of the 1930s , the Long Depression of the 1870s , two world wars , communist revolutions in Russia and in China , and an era of tremendous social and political upheaval in the West ."
political,f,bus,Bus14_en.conllu || Bus9_en.conllu,10,0,0,1,9,0.0,0.0,1.0,appreciation,1.0,,,"One set of causes is political : lower taxes , deregulation , particularly of financial services , privatization , weaker legal protections for trade unions , all of these have contributed to more and more income going to the very , very top .","A lot of these political factors can be broadly lumped under the category of "" crony capitalism , "" political changes that benefit a group of well - connected insiders but do n't actually do much good for the rest of us . || It gets tempting at that point to use your economic nous to manipulate the rules of the global political economy in your own favor . || And why stop at just playing the global political and economic system as it exists to your own maximum advantage ? || Once you have the tremendous economic power that we 're seeing at the very , very top of the income distribution and the political power that inevitably entails , it becomes tempting as well to start trying to change the rules of the game in your own favor . || But it 's important to remember that before we learned how to share the fruits of the Industrial Revolution with the broad swathes of society , we had to go through two depressions , the Great Depression of the 1930s , the Long Depression of the 1870s , two world wars , communist revolutions in Russia and in China , and an era of tremendous social and political upheaval in the West ."
hard,f,bus,Bus13_en.conllu || Bus14_en.conllu || Bus15_en.conllu || Bus9_en.conllu,10,0,0,2,8,0.0,0.0,1.0,appreciation,1.0,,,"Changes which are slow and gradual can be hard to notice even if their ultimate impact is quite dramatic . || But I 'll be the first one to tell you , this subject matter can be hard , awkward , uncomfortable -- but that 's kind of the point .","So I continue to think that transportation is the center of the hard universe . || But while getting rid of crony capitalism in practice is really , really hard , at least intellectually , it 's an easy problem . || But while it 's pretty easy to see how globalization and the technology revolution are creating this global plutocracy , what 's a lot harder is figuring out what to think about it . || He says , if you 're trying to solve a really hard problem , really hard , that you should have a diverse group of people , including those with diverse intellects . || If you are trying to solve a really hard problem , you can speak up and be color brave ."
right,f,bus,Bus10_en.conllu || Bus13_en.conllu || Bus15_en.conllu || Bus9_en.conllu,9,1,0,0,8,1.0,0.0,0.0,affect,1.0,It took me a year and a half to get the insurance just right .,,,"All right , let me show you some more about this . || All right . || Now it turns out you 're right . || Every single decision , I have to think about what is right for both sides . || There are literally no words , right ?"
