en_form,domain,en_sense,de_aligned_forms,de_aligned_counts,example_en_sentence,example_de_sentence,n_instances,total_en_form_instances_in_domain,pct_of_form_in_domain
different,Med,Judgement,"anders, unterscheidet","anders:1, unterscheidet:1","We call this antiangiogenic therapy , and it 's completely different from chemotherapy , because it selectively aims at the blood vessels that are feeding the cancers .","Wir nennen dies Anti - angiogenetische Therapie , und sie unterscheidet sich grundsätzlich von der Chemotherapie weil sie ausschliesslich auf die Blutgefässe abzielt , die den Krebs ernähren .",2,6,0.3333
different,Med,Appreciation,"anders, unterschiedliche","anders:3, unterschiedliche:1","Now realize that in a recently infected person , there are millions of these ships ; each one is just slightly different .","Sie müssen verstehen , dass es in einer kürzlich infizierten Person Millionen dieser Schiffe gibt , jedes ein kleines bisschen anders .",4,6,0.6667
effective,Med,Affect,,,,,0,5,0.0
effective,Med,Judgement,"effektiv, effektiver, wirksamer","effektiv:1, effektiver:1, wirksamer:1","But if you change the form that you give the placebo in , like you make a smaller pill , and color it blue , and stamp a letter into it , it is actually measurably more effective .","Aber wenn Sie die Form , in der Sie das Placebo verabreichen , zu dem Beispiel in eine kleinere Pille verändern , und diese blau färben und einen Buchstaben darauf prägen , ist sie tatsächlich messbar effektiver .",3,5,0.6
effective,Med,Appreciation,"Erfolge, effektiv","Erfolge:1, effektiv:1",These surgeries were actually now being effective .,Diese Operationen zeigten nun tatsächlich Erfolge .,2,5,0.4
good,Med,Affect,gut,gut:2,And I felt really good .,Ich fühlte mich richtig gut .,2,13,0.1538
good,Med,Judgement,,,"So our feeling is , if it 's good enough for the rugby team , it 's good enough for health and poverty .","Also ist unser Empfinden , wenn es fürs Rugby - Team reicht , dann reicht es auch für Gesundheit und Armut .",1,13,0.0769
good,Med,Appreciation,"gut, auch, sinnvoll","gut:8, auch:1, sinnvoll:1","So the shorter the bar , the less angiogenesis -- that 's good .","Also um so kürzer der Balken , desto weniger Angiogenese , das ist gut .",10,13,0.7692
happy,Med,Affect,"glücklich, Gehirn, unglücklich","glücklich:2, Gehirn:1, unglücklich:1","And so it is not just what 's happening to these people -- whether they 're losing weight or gaining weight , or becoming rich or becoming poor , or becoming happy or not becoming happy -- that affects us ; it 's also the actual architecture of the ties around us .","Und es ist deshalb nicht nur das , was diesen Menschen passiert -- ob sie abnehmen oder zunehmen , oder reich oder arm werden , oder glücklich oder unglücklich werden -- was uns beeinflusst ; Es ist auch die gegenwärtige Architektur von diesen Verbindungen um uns herum .",4,8,0.5
happy,Med,Judgement,"glücklich, gesund","glücklich:3, gesund:1","Again , a social network , but now we color the people yellow if they 're happy and blue if they 're sad and green in between .","Wieder ein soziales Netzwerk , aber jetzt färben wir die Leute gelb , wenn sie glücklich sind , und blau , wenn sie traurig sind , und grün dazwischen .",4,8,0.5
happy,Med,Appreciation,,,,,0,8,0.0
hard,Med,Affect,,,,,0,8,0.0
hard,Med,Judgement,"schwierig, sehr","schwierig:4, sehr:1","He needs help eating , he needs help getting dressed , he does n't really know where he is or when it is , and it 's been really , really hard .","Er braucht Hilfe bei dem Essen , er braucht Hilfe bei dem Anziehen , er weiß nie wirklich , wo er ist oder wann er ist , und das ist sehr , sehr schwierig .",5,8,0.625
hard,Med,Appreciation,"schwierig, schwer","schwierig:2, schwer:1","The science is hard , the regulatory regime is difficult .",Der wissenschaftliche Teil ist schwer . Die Regulierungsbedingungen sind komplex .,3,8,0.375
healthy,Med,Affect,gesund,gesund:2,"We started with the prescription pad -- a very ordinary piece of paper -- and we asked , not what do patients need to get healthy -- antibiotics , an inhaler , medication -- but what do patients need to be healthy , to not get sick in the first place ?","Wir starteten mit einem Rezept - Block – ein einfaches Stück Papier – und wir fragten nicht , was Patienten brauchten , um gesund zu werden – Antibiotika , ein Inhalationsgerät , Medikamente – sondern was Patienten brauchten , um gesund zu sein und gar nicht erst krank zu werden .",2,8,0.25
healthy,Med,Judgement,"gesund, Gesundheit","gesund:2, Gesundheit:1","But today we have a thousand college student advocates who are working to connect nearly 9,000 patients and their families with the resources that they need to be healthy .","Heute haben wir gut tausend Anwaltsstudenten , die für uns arbeiten und die fast 9.000 Patienten und ihre Familien mit den Ressourcen versorgen , die sie für ihre Gesundheit benötigen .",3,8,0.375
healthy,Med,Appreciation,gesund,gesund:3,What if our health care system kept us healthy ?,"Rebecca Onie : Was , wenn unser Gesundheitswesen uns gesund erhielte ?",3,8,0.375
higher,Med,Affect,,,,,0,5,0.0
higher,Med,Judgement,,,,,0,5,0.0
higher,Med,Appreciation,"höher, oben","höher:4, oben:1","In the developing world , the data is much sketchier but the death toll is almost certainly higher .","In den Entwicklungsländern sind die Daten viel lückenhafter , aber die Zahl der Todesopfer ist beinahe garantiert höher .",5,5,1.0
interested,Med,Affect,"interessiere, interessierten","interessiere:1, interessierten:1",And here is a growing list of antiangiogenic foods and beverages that we 're interested in studying .,Und hier sehen Sie eine wachsende Liste von anti - antiogenetischen Lebensmitteln und Getränken die wir studieren wollen .,3,6,0.5
interested,Med,Judgement,interessierten,interessierten:1,"So they got very interested in producing convulsions , measured types of convulsions .","Daher interessierten sie sich sehr für das Auslösen von Krämpfen , abgemessenen Arten von Krämpfen .",1,6,0.1667
interested,Med,Appreciation,"interessieren, interessiert","interessieren:1, interessiert:1","For some time I have been interested in the placebo effect , which might seem like an odd thing for a magician to be interested in , unless you think of it in the terms that I do , which is , "" Something fake is believed in enough by somebody that it becomes something real . ""","Seit einiger Zeit interessiere ich mich für den Placebo - Effekt . Es mag merkwürdig erscheinen , dass sich ein Magier dafür interessiert , es sei denn , Sie betrachten es so wie ich , als "" eine Täuschung , die zu etwas Echtem wird , wenn jemand nur fest genug daran glaubt . """,2,6,0.3333
obese,Med,Affect,,,,,0,6,0.0
obese,Med,Judgement,,,,,0,6,0.0
obese,Med,Appreciation,"fettleibig, korpulent","fettleibig:5, korpulent:1","This here shows , on the Y - axis , the increase in the probability that a person is obese given that a social contact of theirs is obese and , on the X - axis , the degrees of separation between the two people .","Das hier zeigt auf der Y- Achse den Anstieg der Wahrscheinlichkeit , dass eine Person fettleibig ist , ausgehend von ihren sozialen Kontakten , die fettleibig sind . Und auf der X- Achse , der Grad an ( sozialer ) Entfernung zwischen diesen zwei Menschen .",6,6,1.0
old,Med,Affect,,,,,0,5,0.0
old,Med,Judgement,"alt, Lebens","alt:3, Lebens:1",How can it be that 2.6 million babies die around the world before they 're even one month old ?,"Wie kann es sein , dass 2,6 Millionen Babys auf der ganzen Welt sterben , bevor sie überhaupt einen Monat alt sind ?",4,5,0.8
old,Med,Appreciation,jünger,jünger:1,"Neonatal is simply an adjective , an adjective that means that the child is less than one month old .","Neugeboren ist bloß ein Adjektiv , ein Adjektiv mit der Bedeutung , dass das Kind jünger als einen Monat ist .",1,5,0.2
right,Med,Affect,"richtig, recht","richtig:2, recht:1","However , subjecting myself to that interrogation -- I answered all their questions , and I guessed on quite a few but I got them right -- and I finally landed the lab space I needed .","Aber ich stellte mich der Befragung , beantwortete all ihre Fragen , und musste auch bei manchen raten , aber ich lag richtig , und schliesslich erhielt ich den benötigten Platz in dem Labor .",4,7,0.5714
right,Med,Judgement,"also, richtig","also:1, richtig:1",Well she was back all right .,Sie war also zurück .,2,7,0.2857
right,Med,Appreciation,recht,recht:1,Fear that the naysayers were right and the cats would simply find a new food .,"Angst , dass die Neinsager recht hatten , und dass die Katzen einfach ein anderes Futter finden würden .",1,7,0.1429
sorry,Med,Affect,"leid, Entschuldigung, bedaure","leid:3, Entschuldigung:1, bedaure:1","I 'm sorry about that , but I strive to learn one thing that I can pass on to other people .","Ich bedaure das . bin aber aber ich versuche best möglich daraus zu lernen , um es andere weiterzugeben .",5,5,1.0
sorry,Med,Judgement,,,,,0,5,0.0
sorry,Med,Appreciation,,,,,0,5,0.0
sure,Med,Affect,"sicher, ,, , dass, Ahnung, dass","sicher:4, ,:2, , dass:2, Ahnung:1, dass:1","One professor even went through my entire procedure , painstakingly -- I 'm not really sure where he got all this time -- and he went through and said why each and every step was like the worst mistake I could ever make .","Ein Professor ging sogar meine gesamte Anleitung ganz akribisch durch -- ich weiß nicht , woher er die Zeit nahm -- und er ging sie durch und sagte mir , warum jeder Schritt darin der schlimmste Fehler war , den ich machen könnte .",11,12,0.9167
sure,Med,Judgement,,,,,0,12,0.0
sure,Med,Appreciation,",",",:1","It 's like , as many times as the virus changes its clothes , it 's still wearing the same socks , and now our job is to make sure we get the body to really hate those socks .","Es ist als ob das Virus , egal wie oft es seine Kleider wechselt , immer noch die selben Socken trägt , und unsere Aufgabe ist es jetzt , sicher zu stellen , dass der Körper diese Socken wirklich hasst .",1,12,0.0833
worse,Med,Affect,schlechter,schlechter:1,But too often my treatments made them feel worse .,Aber in zu vielen Fällen fühlten sie sich durch meine Behandlung schlechter .,1,5,0.2
worse,Med,Judgement,,,,,0,5,0.0
worse,Med,Appreciation,"schlimmer, schlechter","schlimmer:3, schlechter:1",The second mistake that I made was worse .,Mein zweiter Fehler war schlimmer .,4,5,0.8
able,Phi,Affect,können,können:1,"For the first time in the history of this planet , we are able to directly design organisms .","Zu dem ersten Mal in der Geschichte unseres Planeten , können wir ohne Umwege Organismen entwickeln .",3,9,0.3333
able,Phi,Judgement,"Lage, benutzen","Lage:1, benutzen:1","Tell us , Charlie , why would you say he should be able to use a golf cart ?","Sagen Sie uns , Charlie , warum sagen Sie , er sollte den Golfwagen benutzen ?",2,9,0.2222
able,Phi,Appreciation,"isolieren, können","isolieren:1, können:1","One blueprint for trouble , making collapse likely , is where there is a conflict of interest between the short - term interest of the decision - making elites and the long - term interest of the society as a whole , especially if the elites are able to insulate themselves from the consequences of their actions .","Ein Rezept für Probleme , die den Kollaps wahrscheinlich machen , ist , wenn ein Interessenkonflikt besteht zwischen kurzfristigen Interessen der Entscheidungsträger und den langfristigen Interessen der Gesellschaft als Ganzes , besonders wenn die Eliten sich von den Konsequenzen ihrer Handlungen isolieren können .",4,9,0.4444
afraid,Phi,Affect,"befürchte, konkurrenzfähig","befürchte:1, konkurrenzfähig:1","We see this in medicine . ( "" Although it 's nothing serious , let 's keep an eye on it to make sure it does n't turn into a major lawsuit . "" ) And we certainly see it in the world of business . ( "" In order to remain competitive in today 's marketplace , I 'm afraid we 're going to have to replace you with a sleezeball . "" ) ( "" I sold my soul for about a tenth of what the damn things are going for now . "" ) It is obvious that this is not the way people want to do their work .","Wir sehen dies in der Medizin . ( "" Obwohl es nichts Ernstes ist , lasst es uns in dem Auge behalten um sicher zu gehen , dass daraus keine ernste Klage wird . "" ) Wir sehen es deutlich in der Geschäftswelt . ( "" Um in dem heutigen Markt konkurrenzfähig zu bleiben , müssen wir sie leider durch einen Widerling ersetzen . "" ) ( "" Ich hab meine Seele für ein zehntel dessen verkauft , was das verdammte Ding heute wert ist . "" ) Es ist offensichtlich , dass dies nicht die Art ist wie Leute arbeiten wollen .",2,3,0.6667
afraid,Phi,Judgement,verängstigt,verängstigt:1,"Well , pretty soon they were barraged with enraged letters , death threats , ban on the topic in a number of scientific journals , coming from irate left - handers and their advocates , and they were literally afraid to open their mail because of the venom and vituperation that they had inadvertently inspired .","Wie dem auch sei , schon bald wurden Sie bombardiert mit erbosten Briefen , Todesdrohungen , einer Sperre zu diesem Thema in gewissen wissenschaftlichen Zeitschriften zu publizieren , die von empörten Linkshändern und deren Anwälten stammten und sie waren buchstäblich zu verängstigt , ihre Post zu öffnen , wegen der Giftigkeiten und Schmähungen die sie aus Unachtsamkeit heraufbeschworen haben .",1,3,0.3333
afraid,Phi,Appreciation,,,,,0,3,0.0
better,Phi,Affect,"besser, besseres","besser:3, besseres:1",We 'll all be better off if good music is played rather than terrible music .,Wir alle wären besser dran wenn eine gute Musik und nicht schlechte gespielt werden würde .,4,28,0.1429
better,Phi,Judgement,besser,besser:7,"But a cold climate is n't necessarily fatal , because the Inuit -- the Eskimos inhabiting Greenland at the same time -- did better , rather than worse , with cold climates .","Jh . Aber ein kaltes Klima ist nicht notwendigerweise fatal , denn den Inuit , den Eskimos , die gleichzeitig auf Grönland lebten - ging es dabei besser statt schlechter .",7,28,0.25
better,Phi,Appreciation,"besser, bessere, bessern","besser:12, bessere:2, bessern:1","If you have one reason for doing something and I give you a second reason for doing the same thing , it seems only logical that two reasons are better than one and you 're more likely to do it .","Wenn man einen Grund hat etwas zu tun und einen Zweiten für die gleiche Aktion bekommt scheint es logisch , dass zwei Gründe besser als einer sind und es wahrscheinlicher ist , dass man es tut .",17,28,0.6071
close,Phi,Affect,,,,,0,4,0.0
close,Phi,Judgement,nah,nah:1,"I do n't have an answer to how this impacts on our dignity , other than to suggest that maybe the seventh kingdom , because it 's so close to what life is about , maybe we can bring it back and have it help us monitor life .","Ich habe keine Antwort darauf , wie das unsere Würde betrifft , nur den Vorschlag , dass vielleicht das siebte Reich , weil es so nah an dem ist , worum es bei Leben geht , vielleicht können wir es zurück bringen und dazu bringen uns zu helfen , das Leben zu kontrollieren .",1,4,0.25
close,Phi,Appreciation,"annähernd, nahe","annähernd:1, nahe:1","There are also societies today that may be close to collapse , such as Nepal , Indonesia and Columbia .","Es gibt auch heute Gesellschaften , die vielleicht nahe an dem Kollaps stehen , wie etwa Nepal , Indonesien und Kolumbien .",3,4,0.75
concerned,Phi,Affect,"beschäftigt, besorgter","beschäftigt:1, besorgter:1","And if we 're more concerned about our fellow primates than we are about insects , as indeed we are , it 's because we think they 're exposed to a greater range of potential happiness and suffering .","Und wenn wir besorgter um andere Primaten als um Insekten sind , was tatsächlich so ist , kommt das daher , dass wir denken , dass sie einer weiteren Bandbreite von potentiellem Glück und Leid ausgesetzt sind .",3,4,0.75
concerned,Phi,Judgement,,,,,0,4,0.0
concerned,Phi,Appreciation,,,"But for that distinction between how things consciously seem and how they really are , you ca n't make that distinction for the very existence of consciousness , because where the very existence of consciousness is concerned , if it consciously seems to you that you are conscious , you are conscious .","Aber bei der Unterscheidung zwischen dem , wie die Dinge uns bewusst sind und wie sie wirklich sind , kann man für das Bewusstsein selbst keine Unterscheidung machen , denn was das Bewusstsein selbst angeht : Wenn es Ihnen bewusst erscheint , dass sie bei Bewusstsein sind , dann sind sie bei Bewusstsein .",1,4,0.25
good,Phi,Affect,gut,gut:1,"And I 'm not just an academic , I 'm a philosopher , so I like to think that I 'm actually pretty good at arguing .","Ich bin nicht nur Wissenschaftler , sondern auch Philosoph , also würde ich behaupten , dass ich sogar sehr gut in dem Streiten bin .",1,18,0.0556
good,Phi,Judgement,gut,gut:5,Is it any good ?,Ist es gut ?,5,18,0.2778
good,Phi,Appreciation,"gut, nützlich, gütig","gut:9, nützlich:2, gütig:1","Especially because the decision makers in the United States are frequently able to insulate themselves from consequences by living in gated compounds , by drinking bottled water and so on . And within the last couple of years , it 's been obvious that the elite in the business world correctly perceive that they can advance their short - term interest by doing things that are good for them but bad for society as a whole , such as draining a few billion dollars out of Enron and other businesses .","Insbesondere , weil die Entscheidungsträger in den USA sich oft von den Konsequenzen isolieren können , indem sie in eingezäunten Vierteln wohnen , Wasser in Flaschen trinken usw . Und in den letzten paar Jahren wurde es offensichtlich , dass die Eliten der Geschäftswelt korrekterweise erkennen , dass sie ihre kurzfristigen Interessen vorantreiben können , indem sie Dinge tun , die zwar gut für sie selbst sind , aber schlecht für die Gesellschaft als Ganzes , etwa ein paar Milliarden Dollar aus Enron und anderen Unternehmen abzweigen .",12,18,0.6667
hard,Phi,Affect,,,,,0,10,0.0
hard,Phi,Judgement,"schwer, schwierig","schwer:1, schwierig:1","Even when we try to get rid of a technology , it 's actually very hard .","Selbst wenn wir versuchen , eine Technik loszuwerden , ist es sehr schwer .",2,10,0.2
hard,Phi,Appreciation,"schwer, schwierig, hart","schwer:5, schwierig:2, hart:1",And the other generalization that I want to mention is that it 's particularly hard for a society to make quote - unquote good decisions when there is a conflict involving strongly held values that are good in many circumstances but are poor in other circumstances .,"Und die andere Verallgemeinerung , die ich erwähnen möchte , ist , dass es besonders hart für eine Gesellschaft ist , gute Entscheidungen zu treffen , wenn Werte stark vertreten werden , die unter vielen Umständen nützlich sind , aber unter anderen Umständen schaden .",8,10,0.8
important,Phi,Affect,,,,,0,6,0.0
important,Phi,Judgement,"wichtig, wichtigsten","wichtig:1, wichtigsten:1",And I think it 's really important .,Und ich denke das ist wirklich wichtig .,2,6,0.3333
important,Phi,Appreciation,wichtig,wichtig:4,"In fact , this idea of resurrecting the whole idea is so important that I began to think about what happens with old technology .","In der Tat ist diese Idee der Wiederauferstehung der ganzen Idee so wichtig , dass ich anfing , nachzudenken , was mit alter Technik passiert .",4,6,0.6667
interested,Phi,Affect,"interessiert, Heute, interesse, interessieren","interessiert:2, Heute:1, interesse:1, interessieren:1",But I was interested in another definition of technology .,Aber ich habe mich für eine andere Technikdefinition interessiert .,5,6,0.8333
interested,Phi,Judgement,,,,,0,6,0.0
interested,Phi,Appreciation,interessieren,interessieren:1,"The second reason is that when people do get interested in it , as I think they should , they tend to say the most appalling things .","Zweitens : Wenn Leute sich dafür interessieren ‒ und das sollten sie auch ‒ neigen sie dazu , entsetzliche Dinge zu sagen .",1,6,0.1667
obvious,Phi,Affect,",",",:1","It seems to me , therefore , patently obvious that we can no more respect and tolerate vast differences in notions of human well - being than we can respect or tolerate vast differences in the notions about how disease spreads , or in the safety standards of buildings and airplanes .","Ich denke daher , es liegt auf der Hand , dass wir nicht mehr Respekt und Toleranz gegenüber enormen Unterschieden in der Wahrnehmung menschlichen Wohlbefindens zeigen können , genau wie wir enorme Unterschiede in der Ansicht wie sich Krankheiten verbreiten , nicht mehr respektieren oder tolerieren können , oder in den Sicherheitsstandards von Gebäuden und Flugzeugen .",1,4,0.25
obvious,Phi,Judgement,offensichtlich,offensichtlich:1,"There 's a sense in which it 's obvious , and yet , let me tell you a little story .","Man hat ein Gefühl , dass dies offensichtlich ist aber ich werde trotzdem eine kleine Geschichte erzählen .",1,4,0.25
obvious,Phi,Appreciation,"nahe, offensichtlich","nahe:1, offensichtlich:1","Now , you may say , well , that 's obvious enough .","Jetzt , können Sie sagen , es ist nahe liegend genug .",2,4,0.5
right,Phi,Affect,richtig,richtig:1,"And we 've got to get them all right , because if we solve 11 , we fail to solve the 12th -- we 're in trouble .","Und wir müssen sie alle lösen , denn wenn wir 11 lösen , und das 12. nicht , dann sind wir in Schwierigkeiten .",2,19,0.1053
right,Phi,Judgement,"richtig, Recht, recht","richtig:4, Recht:1, recht:1","Barack Obama said , before he was inaugurated , "" We must ask not just ' Is it profitable ? ' but ' Is it right ? ' "" And when professions are demoralized , everyone in them becomes dependent on -- addicted to -- incentives and they stop asking "" Is it right ? ""","Barack Obama sagte , vor seiner Amtseinführung , Wir müssen nicht nur fragen ' Ist es profitabel ? ' sondern ' Ist es richtig ? ' Sobald Berufe demoralisiert sind wird jeder der diese ausübt abhängig von - und süchtig nach - Anreizen und es wird nicht mehr gefragt "" Ist es richtig ? """,7,19,0.3684
right,Phi,Appreciation,"richtig, stimmen, Ordnung, genau, recht","richtig:3, stimmen:2, Ordnung:1, genau:1, recht:1",That 's all right .,Es ist in Ordnung .,10,19,0.5263
special,Phi,Affect,,,,,0,4,0.0
special,Phi,Judgement,,,,,0,4,0.0
special,Phi,Appreciation,besonders,besonders:4,Nothingness is special .,Das Nichts ist besonders .,4,4,1.0
subjective,Phi,Affect,,,,,0,5,0.0
subjective,Phi,Judgement,subjektiv,subjektiv:1,"So the objection that you ca n't have an objective science of consciousness because it 's subjective and science is objective , that 's a pun .","Der Einspruch , dass es keine objektive Wissenschaft des Bewusstseins gäbe weil es subjektiv und Wissenschaft objektiv ist , ist ein Wortspiel .",1,5,0.2
subjective,Phi,Appreciation,"subjektiv, objektiv subjektiv, objektive","subjektiv:2, objektiv subjektiv:1, objektive:1","Science is objective , consciousness is subjective , therefore there can not be a science of consciousness .","Die Wissenschaft ist objektiv , das Bewusstsein ist subjektiv . Daher kann es keine Wissenschaft des Bewusstseins geben .",4,5,0.8
sure,Phi,Affect,"sicher, ,, sicherlich, wissen","sicher:5, ,:1, sicherlich:1, wissen:1",And I 'm not even sure we know what technology is .,"Und ich bin mir nicht mal sicher , ob wir wissen , was Technik ist .",9,9,1.0
sure,Phi,Judgement,,,,,0,9,0.0
sure,Phi,Appreciation,,,,,0,9,0.0
true,Phi,Affect,,,,,0,7,0.0
true,Phi,Judgement,wahr,wahr:1,"It 's a pious hope , I wish it were true , but I think the other day he admitted to me it 's really an ugly universe .","Es ist ein frommer Wunsch und ich wünschte , es wäre wahr , aber ich denke , dass er mir letztens gestanden hat , dass es ein wirklich hässliches Universum ist .",1,7,0.1429
true,Phi,Appreciation,"wahr, falsch, gilt","wahr:4, falsch:1, gilt:1","Every single thing that we can think of -- and if you heard Olivia 's talk about the sexual habits , you 'll realize that there is n't anything we can say that 's true for all life , because every single one of them is hacking something about it .","Jede einzelne Sache , die wir uns vorstellen können -- und sie haben Olivias Talk über das Sexualverhalten gehört , sie werden merken , dass es nichts gibt , was für das gesamte Leben gilt , weil jeder Einzelne von ihnen etwas darin hackt .",6,7,0.8571
worried,Phi,Affect,besorgt,besorgt:1,That 's not what I 'm really worried about .,Dies ist nicht was mich wirklich besorgt .,1,4,0.25
worried,Phi,Judgement,"beunruhigt, sich falsch","beunruhigt:1, sich falsch:1",He was worried about right and wrong .,Er sorgte sich um richtig und falsch .,2,4,0.5
worried,Phi,Appreciation,sorgen,sorgen:1,"And she said , "" Your dad and I are really worried about you . ""","Sie sagte : "" Dein Vater und ich sorgen uns um dich . """,1,4,0.25
worse,Phi,Affect,,,,,0,5,0.0
worse,Phi,Judgement,schlimmer,schlimmer:2,It gets worse than that -- or perhaps better than that .,Es kommt noch schlimmer – oder vielleicht besser .,2,5,0.4
worse,Phi,Appreciation,"gewachsen, verschlimmert","gewachsen:1, verschlimmert:1","See -- most Americans believe that poverty has gotten worse since we were children , since they saw that vision .","Sehen Sie -- die meisten Amerikaner glauben , dass die Armut zunahm , seit wir Kinder waren und Sie dieses Bild gesehen haben .",3,5,0.6
worth,Phi,Affect,,,,,0,8,0.0
