en_form,domain,en_sense,de_aligned_forms,de_aligned_counts,example_en_sentence,example_de_sentence,n_instances,total_en_form_instances_in_domain,pct_of_form_in_domain
famous,Ent,Affect,berühmt,berühmt:2,"And when I started my blog , it was really this one goal -- I said , "" I am not going to be famous to the world , but I could be famous to people on the Internet . ""","Und als ich den Blog begann , hatte ich wirklich nur ein Ziel . Ich wusste , ich würde nicht auf der ganzen Welt berühmt werden . Aber ich könnte für die Leute in dem Internet berühmt werden .",2,3,0.6667
famous,Ent,Judgement,,,,,0,3,0.0
famous,Ent,Appreciation,berühmt,berühmt:1,Any one of you could be famous on the Internet by next Saturday .,Jeder einzelne von euch könnte über das Internet bis nächsten Samstag berühmt sein .,1,3,0.3333
good,Ent,Affect,"gut, Stärke, weniger","gut:6, Stärke:1, weniger:1",We feel that we are not as good in reality as we are in games .,"Wir denken , dass wir in der Realität nicht so gut sind wie in Spielen .",8,17,0.4706
good,Ent,Judgement,gut,gut:3,"Nobody wants to change how they live , just because it 's good for the world , or because we 're supposed to .","Niemand möchte sein Leben ändern , weil es gut für die Umwelt ist oder weil wir es sollten .",3,17,0.1765
good,Ent,Appreciation,"gut, Nutzen, schlecht","gut:4, Nutzen:1, schlecht:1",That 's not good .,Das ist nicht gut .,6,17,0.3529
great,Ent,Affect,:,::1,"And I thought , well , great .",Da dachte ich :,1,4,0.25
great,Ent,Judgement,super,super:1,"And do n't get me wrong -- sometimes I loved it and it was great , but other times , I felt like I had been left alone to fend for myself .","Verstehen Sie mich nicht falsch -- manchmal war es super , aber es gab Zeiten , in denen ich mich verlassen fühlte ; alleine kämpfte .",1,4,0.25
great,Ent,Appreciation,"daran, klar","daran:1, klar:1",So that 's great .,Alles klar . Prima .,2,4,0.5
happy,Ent,Affect,"glücklich, froh dass","glücklich:2, froh dass:1","I was n't happy with my job , because I was a designer , but I was n't being really stimulated .","Ich war nicht glücklich mit meinem Job , ich war eine Designerin , aber das war nicht sehr stimulierend .",3,9,0.3333
happy,Ent,Judgement,glücklich,glücklich:5,"I ca n't tell if she 's happy or sad , and I change my mind all the time .","Ich weiß nicht , ob sie glücklich oder traurig ist , und ich ändere ständig meine Meinung .",5,9,0.5556
happy,Ent,Appreciation,kriegswütig,kriegswütig:1,"Your pupils dilate , your muscles contract , your Spidey sense tingles , basically your whole body is trigger - happy .","Die Pupillen erweitern sich , die Muskeln spannen sich an , dein "" Spidey sense "" meldet sich , dein ganzer Körper ist nur kriegswütig .",1,9,0.1111
important,Ent,Affect,wichtig,wichtig:1,So -- the life record of a blog is something that I find incredibly important .,"Also , die Aufzeichnung eines Lebens auf einem Blog ist etwas , das ich unglaublich wichtig finde .",1,6,0.1667
important,Ent,Judgement,,,,,0,6,0.0
important,Ent,Appreciation,"wichtig, Wichtig","wichtig:4, Wichtig:1","I think that media companies are going to hire a lot more women , because they realize this is important for their business , and I think that women are also going to continue to dominate the social media sphere .","Ich denke , dass die Medienkonzerne viel mehr Frauen anstellen werden , weil sie erkennen , dass es für ihr Business wichtig ist . Und ich denke , dass Frauen auch weiterhin dominieren werden in dem Bereich der Social Media .",5,6,0.8333
nervous,Ent,Affect,"nervös, nervöser nervöser","nervös:6, nervöser nervöser:1","Over the past couple of days , as I 've been preparing for my speech , I 've become more and more nervous about what I 'm going to say and about being on the same stage as all these fascinating people .","Die letzten paar Tage , als ich meinen Vortrag vorbereitet habe , wurde ich immer nervöser und nervöser darüber , was ich sagen würde und darüber , auf der Bühne zu sein , genau wie all diese faszinierenden Menschen .",7,7,1.0
nervous,Ent,Judgement,,,,,0,7,0.0
nervous,Ent,Appreciation,,,,,0,7,0.0
old,Ent,Affect,"alt, elf","alt:4, elf:1","When I was four years old , I have a vivid memory of finding two pinpoint scars on my ankle and asking my dad what they were .","Als ich vier Jahre alt war -- ich erinnere mich lebhaft -- fand ich zwei spitze Narben an meinem Fußgelenk und fragte meinen Vater , was das sei .",5,5,1.0
old,Ent,Judgement,,,,,0,5,0.0
old,Ent,Appreciation,,,,,0,5,0.0
possible,Ent,Affect,,,,,0,5,0.0
possible,Ent,Judgement,möglich,möglich:1,"An epic win is an outcome that is so extraordinarily positive , you had no idea it was even possible until you achieved it .","Ein epischer Sieg ist ein Ergebnis , das so überaus positiv ist , dass Sie vorher gar nicht wussten , dass es überhaupt möglich war .",1,5,0.2
possible,Ent,Appreciation,möglich,möglich:4,"Gamers always believe that an epic win is possible , and that it 's always worth trying , and trying now .","Spieler glauben immer daran , dass ein epischer Sieg möglich ist , und dass es sich immer lohnt , es zu versuchen , und zwar gleich .",4,5,0.8
right,Ent,Affect,richtig,richtig:1,You do n't think I was right ?,"Du denkst , das war nicht richtig ?",1,7,0.1429
right,Ent,Judgement,geht,geht:1,It 's all right .,Es geht .,1,7,0.1429
right,Ent,Appreciation,"richtig, ,, normal","richtig:2, ,:1, normal:1","Actually , that whole row is n't right .",Eigentlich ist die gesamte Reihe hier nicht ganz normal .,5,7,0.7143
same,Ent,Affect,,,,,0,8,0.0
same,Ent,Judgement,"Gleiche, gleich, gleichen","Gleiche:1, gleich:1, gleichen:1","Film , it 's an incredible medium , but essentially , it 's the same now as it was then . It 's a group of rectangles that are played in a sequence . And we 've done incredible things with those rectangles .","Film ist ein unglaubliches Medium , aber in dem Prinzip das Gleiche wie früher : eine Serie von rechteckigen Bildern , die nacheinander abgespielt werden .",4,8,0.5
same,Ent,Appreciation,"gleichen, gleich, gleiche","gleichen:2, gleich:1, gleiche:1",I want you to first notice that those two desert scenes are physically the same .,"Ich möchte , dass Sie zuerst erkennen , dass diese zwei Wüstenszenen physikalisch die gleichen sind .",4,8,0.5
sure,Ent,Affect,"sicher, todsicher","sicher:2, todsicher:1","And apparently , evolution had occurred at a pretty rapid rate on One Tree , between the time they named it and the time I arrived , because I 'm sure there were at least three trees on that island when we were there .","Offensichtlich war eine ziemlich rapide Entwicklung auf One Tree von statten gegangen seit der Zeit , als sie die Insel benannten bis ich dort ankam , denn ich bin mir sicher , dass es auf dieser Insel mindestens drei Bäume gab , als wir dort waren .",4,4,1.0
sure,Ent,Judgement,,,,,0,4,0.0
sure,Ent,Appreciation,,,,,0,4,0.0
true,Ent,Affect,,,,,0,10,0.0
true,Ent,Judgement,stimmt,stimmt:1,It 's true .,Das stimmt .,2,10,0.2
true,Ent,Appreciation,"stimmt, Wahrheit, generell, gilt, stimmen, wahr, zutreffend","stimmt:2, Wahrheit:1, generell:1, gilt:1, stimmen:1, wahr:1, zutreffend:1","But actually , according to my research at the Institute for the Future , actually the opposite is true .","Tatsächlich aber , meiner Forschung an dem Institut für die Zukunft zufolge , ist genau das Gegenteil zutreffend .",8,10,0.8
able,His,Affect,"in Lage, lernen","in Lage:1, lernen:1","And because of the fact that I realized that I was able to learn things visually that I could n't learn in other ways , this became my strategy , this became my tactic for understanding everything else .","Weil ich jetzt die Sachen bildlich lernen konnte , dass ich anders lernen konnte , wurde das meine Strategie , meine Taktik auch alles andere zu verstehen .",3,7,0.4286
able,His,Judgement,,,"With stalwart audiences like this , the Peerzadas were able to conclude their festival on schedule .",Mit einem solch standhaften Publikum konnten die Peerzadas ihr Festival wie geplant abschließen .,2,7,0.2857
able,His,Appreciation,"Lage, können","Lage:1, können:1","And on the back are some other devices , measuring tools and scales , to be able to make some calculations .","Und auf der Rückseite sind einige andere Spielereien , Messwerkzeuge , und Skalen , um einige Kalkulationen machen zu können .",2,7,0.2857
about,His,Affect,,,,,0,4,0.0
about,His,Judgement,dabei,dabei:2,But as he was about to put his signature on the Proclamation his own hand was numb and shaking because he had shaken a thousand hands that morning at a New Year 's reception .,"Aber als er gerade dabei war , seine Unterschrift unter die Proklamation zu setzen , war seine Hand taub und zitterte , weil er an dem Morgen tausend Hände während eines Neujahrsempfangs geschüttelt hatte .",3,4,0.75
about,His,Appreciation,gleich,gleich:1,"That spark is about to be conferred by the creator in that finger , which is one millimeter from the hand of Adam .","Dieser Funke wird ihm gleich von dem Schöpfer in den Finger übertragen , der einen Millimeter von Adams Hand entfernt ist .",1,4,0.25
alone,His,Affect,allein,allein:2,"But another part of me said , this is remarkable . Here I am alone in my office , but I 'm not alone at all .","Andererseits dachte ich , das ist erstaunlich , hier sitze ich allein in meinem Büro , aber ich bin überhaupt nicht allein .",2,3,0.6667
alone,His,Judgement,,,,,0,3,0.0
alone,His,Appreciation,allein,allein:1,"Despite all that power , all that wealth , he was alone when he finally died -- his ultimate terror realized .","Trotz dieser Macht , trotz dieses Wohlstands war er allein , als er starb - seine größte Angst wurde wahr .",1,3,0.3333
amazing,His,Affect,,,,,0,4,0.0
amazing,His,Judgement,"erstaunlicher, wunderbar","erstaunlicher:1, wunderbar:1",She is amazing .,Sie ist wunderbar .,2,4,0.5
amazing,His,Appreciation,"großartig, toll","großartig:1, toll:1",This is just amazing .,Das ist einfach großartig .,2,4,0.5
better,His,Affect,verbessert,verbessert:1,"We 've got technology on our side , and it keeps getting better .","Wir haben die Technologie auf unserer Seite , die sich stetig verbessert .",1,4,0.25
better,His,Judgement,besser,besser:1,"Because if we get it out of the streets , it 'll smell much better , and -- oh right , we drink from the river .","Es würde ja viel besser riechen , wenn der Abfall aus den Straßen wegkommt . Und ... ach ja , richtig , wir trinken ja aus dem Fluss .",1,4,0.25
better,His,Appreciation,besser,besser:2,"Sometimes I still hear her voice in my head saying , with no bravado whatsoever , "" The situation of the women of Afghanistan will be better someday .","Manchmal höre ich sie immer noch ganz ohne Übertreibung sagen : "" Die Situation der Frauen in Afghanistan wird eines Tages besser sein .",2,4,0.5
clear,His,Affect,klar,klar:2,But it soon became clear that Abraham Lincoln would emerge as the undisputed captain of this unruly team .,"Aber es wurde schnell klar , dass Abraham Lincoln als der unumstrittene Kapitän seiner unbändigen Mannschaft hervorgehen würde .",2,3,0.6667
clear,His,Judgement,klar,klar:1,"So , tonight , if it 's clear you 'll be able to see the summer triangle .","Also , heute Nacht ist es klar , ihr werdet das Sommerdreieck sehen können .",1,3,0.3333
clear,His,Appreciation,,,,,0,3,0.0
dead,His,Affect,"bereits tot, erschossen, gestorben","bereits tot:1, erschossen:1, gestorben:1","The people who lived in the myriads of towns and villages and cities on the Eastern front , who watched their neighbors be rounded up -- men , women , children , young , old -- and be marched to the outskirts of the town to be shot and left dead in ditches .","Die Menschen , die in den unzähligen Städten und Dörfern an der Ostfront lebten , die zusahen , wie ihre Nachbarn gefasst wurden -- Männer , Frauen , Kinder , Junge , Alte -- und an den Stadtrand gebracht wurden , um dort erschossen und in Gruben liegen gelassen zu werden .",3,3,1.0
dead,His,Judgement,,,,,0,3,0.0
dead,His,Appreciation,,,,,0,3,0.0
excited,His,Affect,"aufgeregt, begeistert","aufgeregt:2, begeistert:1","Nonetheless I was really excited about it , because in all the other classes that I had , we did n't even have that conversation .","Dennoch hat es mich sehr begeistert , denn in all meinen anderen Kursen , sprachen wir gar nicht darüber .",3,4,0.75
excited,His,Judgement,aufgeregt,aufgeregt:1,"It was said when he got a copy of the King James Bible or "" Aesop 's Fables , "" he was so excited he could n't sleep .","Als er eine Ausgabe der King - James - Bibel hatte , heißt es , oder von "" Äsops Fabeln "" , dann war er so aufgeregt , dass er nicht schlafen konnte .",1,4,0.25
excited,His,Appreciation,,,,,0,4,0.0
good,His,Affect,gut,gut:1,"For on the surface , Lyndon Johnson should have had everything in the world to feel good about in those last years , in the sense that he had been elected to the presidency ; he had all the money he needed to pursue any leisure activity he wanted ; he owned a spacious ranch in the countryside , a penthouse in the city , sailboats , speedboats .","Oberflächlich gesehen hätte Lyndon Johnson alles in der Welt gehabt , um sich die letzten Jahre gut zu fühlen , weil er zu dem Präsidenten gewählt worden war . Er hatte all das Geld , das er brauchte , um in seiner Freizeit zu machen , was er wollte . Ihm gehörten eine weitläufige Ranch auf dem Land , ein Penthouse in der Stadt . Segelboote , Schnellboote .",1,7,0.1429
good,His,Judgement,gut,gut:4,"David Irving was a writer of historical works , most of them about World War II , and virtually all of those works took the position that the Nazis were really not so bad , and the Allies were really not so good .","David Irving war ein Autor historischer Werke , die meisten davon zu dem Zweiten Weltkrieg , und so ziemlich alle dieser Werke vertraten die Position , dass die Nazis gar nicht so schlimm waren und die Alliierten gar nicht so gut .",4,7,0.5714
good,His,Appreciation,"gut, nicht","gut:1, nicht:1","The trick here is my brother would become an experimental poet , not a businessman , but the intention was really good .","Das Lustige dabei ist , dass mein Bruder ein experimenteller Poet geworden ist , und kein Geschäftsmann , aber die Absicht war wirklich gut .",2,7,0.2857
great,His,Affect,,,,,0,3,0.0
great,His,Judgement,"Ur-, großartig","Ur-:1, großartig:1","But they were great , nonetheless .",Sie waren trotzdem großartig .,2,3,0.6667
great,His,Appreciation,groß,groß:1,"The job ahead of us , the task ahead of us , the challenge ahead of us is great .","Die Arbeit , die vor uns liegt , die Aufgabe vor uns , die Herausforderung vor uns , ist groß .",1,3,0.3333
important,His,Affect,,,,,0,3,0.0
important,His,Judgement,wichtig,wichtig:1,"And I do think it is important , and I 'll give you five reasons why , really quickly .","Ich denke , es ist wichtig , und ich nenne Ihnen kurz fünf Gründe .",1,3,0.3333
important,His,Appreciation,"wert, wichtiger","wert:1, wichtiger:1",And I remember thinking in that moment that the bombers made headlines here two years before but this night and these people are as important a story .,"Und ich erinnere mich , wie ich in diesem Moment dachte , dass die Attentäter hier vor zwei Jahren Schlagzeilen gemacht hatten , aber jener Abend und jene Leute sind ebenfalls eine Geschichte wert .",2,3,0.6667
offensive,His,Affect,,,,,0,3,0.0
offensive,His,Judgement,,,,,0,3,0.0
offensive,His,Appreciation,"abstoßend, beleidigend, widerlich","abstoßend:1, beleidigend:1, widerlich:1","What I am talking about is the Muslim extreme right , and the fact that its adherents are or purport to be Muslim makes them no less offensive than the extreme right anywhere else .","Ich spreche hier von dem islamischen Rechtsextremismus und die Tatsache , dass die Anhänger muslimisch sind oder es behaupten zu sein , macht ihn nicht weniger abstoßend als den Rechtsextremismus anderswo .",3,3,1.0
old,His,Affect,alt,alt:2,I was selected as a White House Fellow when I was 24 years old .,"Ich wurde als Stipendiat in dem Weißen Haus ausgewählt , als ich 24 Jahre alt war .",2,6,0.3333
old,His,Judgement,alt,alt:3,"They are over 2,000 years old .",Die sind über 2.000 Jahre alt .,3,6,0.5
old,His,Appreciation,,,My mother was 15 years old when I was born .,"Meine Mutter war 15 , als ich geboren wurde .",1,6,0.1667
rare,His,Affect,,,,,0,4,0.0
rare,His,Judgement,,,,,0,4,0.0
rare,His,Appreciation,"selten, Seltenheit","selten:3, Seltenheit:1","Based on the patients who were brought to his clinic , Kanner speculated that autism is very rare .","Aufgrund der Patienten , die in seine Klinik kamen , spekulierte Kanner , dass Autismus sehr selten sei .",4,4,1.0
safe,His,Affect,Sicherheit,Sicherheit:1,How do I keep my daughter safe ?,Ist meine Tochter in Sicherheit ?,1,4,0.25
safe,His,Judgement,Sicherheit,Sicherheit:3,"A few weeks later , my friend was in a crowd of people pushing with her infant son in her arms to give him to a stranger on a bus , which was one of the last buses leaving Sarajevo to take children out so they could be safe .","Ein paar Wochen später steht meine Freundin in einer Menschenmenge , mit ihrem Baby drückt sie sich nach vorn , um das Kind einem Unbekannten in einem Bus zu geben , es war einer der letzten Busse , der Sarajevo verließ , um die Kinder herauszubringen , damit sie in Sicherheit sind .",3,4,0.75
safe,His,Appreciation,,,,,0,4,0.0
same,His,Affect,,,,,0,8,0.0
same,His,Judgement,"gleich, dasselbe, gleiche","gleich:2, dasselbe:1, gleiche:1",They are the same :,Sie sind alle gleich :,4,8,0.5
same,His,Appreciation,"dasselbe, dieselben, gleich","dasselbe:1, dieselben:1, gleich:1",We must not treat it as if their lies are the same as the facts .,Wir dürfen ihre Lügen nicht als Tatsachen behandeln .,4,8,0.5
simple,His,Affect,,,,,0,4,0.0
simple,His,Judgement,einfach,einfach:1,But it was not to be that simple .,Aber es war nicht ganz so einfach .,1,4,0.25
simple,His,Appreciation,simpel,simpel:3,The idea is actually relatively simple .,Die Idee ist eigentlich relativ simpel .,3,4,0.75
sorry,His,Affect,"Entschuldigen, Leid, bitte, entschuldigen","Entschuldigen:1, Leid:1, bitte:1, entschuldigen:1",""" Whoa , I 'm sorry , hold on , professor , professor .",""" Was , entschuldigen Sie , einen Moment bitte , Professor .",7,7,1.0
sorry,His,Judgement,,,,,0,7,0.0
sorry,His,Appreciation,,,,,0,7,0.0
worth,His,Affect,,,,,0,4,0.0
worth,His,Judgement,"Risiko, Wert","Risiko:1, Wert:1",And it 's worth probably about three MacBook Pros .,Und sein Wert ist wahrscheinlich ungefähr der von drei Macbooks Pro .,2,4,0.5
worth,His,Appreciation,wert,wert:1,"Organizations like HIAS , where I work , and other humanitarian and faith - based organizations , make it easy for you to take a stand when there 's a law that 's worth opposing or a law that 's worth supporting or a policy that needs oversight .","Humanitäre oder religiös geprägte Organisationen oder solche wie HIAS , wo ich bin , stellen sich entschlossen gegen fragwürdige Gesetze , unterstützen solche , die es wert sind , und verweisen auf revisionsbedürftige Richtlinien .",2,4,0.5
wrong,His,Affect,,,,,0,5,0.0
wrong,His,Judgement,geirrt,geirrt:1,Lorna and Judith realized that Kanner had been as wrong about autism being rare as he had been about parents causing it .,"Lorna und Judith erkannten , dass Kanner sich bezüglich der Seltenheit von Autismus und der Verursachung durch die Eltern geirrt hatte .",1,5,0.2
wrong,His,Appreciation,"falsch, Unsinn","falsch:3, Unsinn:1","For most of the 20th century , clinicians told one story about what autism is and how it was discovered , but that story turned out to be wrong , and the consequences of it are having a devastating impact on global public health .","Die Ärzte erzählten eine Geschichte darüber , was Autismus ist und wie es entdeckt wurde , aber diese Geschichte erwies sich als falsch , und die Folge war ein verheerender Einfluss auf die globale öffentliche Gesundheit .",4,5,0.8
able,Med,Affect,"können, Lage, ermöglichte, fähig, gefunden, glücklich, konnten","können:2, Lage:1, ermöglichte:1, fähig:1, gefunden:1, glücklich:1, konnten:1","One professor said , "" Maybe I might be able to help you , kid . ""","Ein Professor sagte : "" Vielleicht kann ich dir helfen , Junge . """,16,22,0.7273
able,Med,Judgement,"Lage, konnten","Lage:3, konnten:1","And he knew her , he would have been able to furnish additional information about her .","Und er kannte sie , er wäre in der Lage gewesen zusätzliche Informationen zu ihr beizusteuern .",4,22,0.1818
able,Med,Appreciation,Lage,Lage:2,"Now , a superorganism is a collection of individuals which show or evince behaviors or phenomena that are not reducible to the study of individuals and that must be understood by reference to , and by studying , the collective . Like , for example , a hive of bees that 's finding a new nesting site , or a flock of birds that 's evading a predator , or a flock of birds that 's able to pool its wisdom and navigate and find a tiny speck of an island in the middle of the Pacific , or a pack of wolves that 's able to bring down larger prey .","Nun , ein Superorganismus ist eine Art Ansammlung von Individuen , welche Verhaltensweisen oder Phänomene zeigen oder bekunden , die nicht auf Untersuchungen von Individuen reduzierbar sind , und die in bezug auf und durch Untersuchungen des Kollektivs verstanden werden müssen , wie zu dem Beispiel ein Bienenstock , der eine neue Niststätte findet , oder ein Vogelschwarm , der einem Raubtier ausweicht , oder ein Vogelschwarm , der in der Lage ist , seine Weisheiten zu vereinen , und der navigiert und einen kleinen Fleck auf einer Insel inmitten des Pazifiks findet , oder ein Rudel Wölfe , das in der Lage ist , eine größere Beute zu erledigen .",2,22,0.0909
available,Med,Affect,,,,,0,4,0.0
available,Med,Judgement,"bereit, verfügbar","bereit:1, verfügbar:1",We patented it so that it would be freely available .,"Wir ließen es patentieren , damit es frei verfügbar ist .",2,4,0.5
available,Med,Appreciation,verfügbar,verfügbar:2,"And in fact , the first pioneering treatments for people as well as dogs , are already becoming available .","Und tatsächlich , die ersten Behandlungsmethoden , für Menschen sowie auch Hunde , werden bereits verfügbar .",2,4,0.5
bad,Med,Affect,schlecht,schlecht:2,Why are we so bad at detecting pancreatic cancer ?,Warum können wir Bauchspeicheldrüsenkrebs so schlecht aufspüren ?,2,6,0.3333
bad,Med,Judgement,schlecht,schlecht:2,But Venus is a very bad -- the worst -- planet .,"Aber Venus ist ganz schlecht , der schlechteste Planet .",2,6,0.3333
bad,Med,Appreciation,schlecht,schlecht:2,"It 's the one that says , not that what you did was bad , but that you are bad .","Es ist diejenige , die einem sagt , das nicht das was man gemacht hat schlecht ist , sondern das man selbst schlecht ist .",2,6,0.3333
better,Med,Affect,"besser, besser fühlen","besser:4, besser fühlen:1","And over the course of the next hour and a half or two , she started to feel better .","Und über einen Zeitraum von eineinhalb bis zwei Stunden , fing sie an sich besser zu fühlen .",5,14,0.3571
better,Med,Judgement,besser,besser:2,She 's doing a lot better this year .,Sie ist dieses Jahr viel besser .,2,14,0.1429
better,Med,Appreciation,"besser, verbessert","besser:6, verbessert:1","This whole Gaia idea , that life makes the world better for itself -- anybody been on a freeway on a Friday afternoon in Los Angeles believing in the Gaia theory ?","Diese ganze Gaia Idee , dass das Leben die Welt für sich verbessert ... Ist jemand schon mal Freitagnachmittags auf der Los Angeles Autobahn gewesen und dabei and die Gaia Theorie geglaubt ?",7,14,0.5
clear,Med,Affect,"klarstellen, missverstehen","klarstellen:1, missverstehen:1","Now , I want to be very clear :","Nicht , dass Sie mich missverstehen :",2,5,0.4
clear,Med,Judgement,klar,klar:1,"It did n't work very well on the schizophrenics , but it was pretty clear in the ' 30s and by the middle of the ' 40s that electroconvulsive therapy was very , very effective in the treatment of depression .","Bei den Schizophrenen hat das nicht besonders gut funktioniert , aber in den 30ern und bis zu der Mitte der 40er war es ziemlich klar , dass Elektrokrampftherapie sehr , sehr effektiv in der Behandlung von Depressionen war .",1,5,0.2
clear,Med,Appreciation,"klar, offensichtlich","klar:1, offensichtlich:1","But if you take the same carbon atoms and interconnect them a different way , you get diamond , which is clear and hard .","Aber wenn Sie dieselben Kohlenstoff - Atome nehmen und sie auf eine andere Weise miteinander verbinden , bekommen Sie einen Diamanten , welcher klar und hart ist .",2,5,0.4
depressed,Med,Affect,"depressiver, depressiv","depressiver:2, depressiv:1","So , as things got worse , as we really began to hate each other , I became progressively depressed over a period of a couple of years trying to save this marriage , which was inevitably not to be saved .","Als also die Dinge schlechter wurden und wir wirklich anfingen uns zu hassen , wurde ich über eine Dauer von ein paar Jahren immer depressiver , während ich versuchte diese Ehe zu retten , die unausweichbar nicht zu retten war .",3,4,0.75
depressed,Med,Judgement,bedrückte,bedrückte:1,"And I was driving home one day , and I get a phone call from the husband 's friend , calling me because he was depressed about what was happening to his friend .","Und ich fuhr eines Tages nach Hause und bekam einen Anruf von einem Freund des Ehemanns , er rief mich an , weil es ihn bedrückte , was mit seinem Freund passierte .",1,4,0.25
depressed,Med,Appreciation,,,,,0,4,0.0
different,Med,Affect,,,,,0,6,0.0
